Code,Name,Description,Prerequisites,Instructors,Meet Times,Credit Hours,Department
MUT1242L,Aural Skills 2,Second of a sequence of four courses that develop skills in sight singing and ear training.,Prereq: Music major or Theatre Performance (Musical Theatre) major.,Hoang Pho,[],1,Music
MVK1112,Secondary Piano 2,,Prereq: Music major.,Charles Pickeral,"[{'meetNo': 1, 'meetDays': ['T', 'R'], 'meetTimeBegin': '11:00 AM', 'meetTimeEnd': '12:15 PM', 'meetPeriodBegin': '3', 'meetPeriodEnd': '3', 'meetBuilding': 'MUB', 'meetBldgCode': '0117', 'meetRoom': '0143'}]",VAR,Music
MVV2421,Voice,,Prereq: Music major or Theatre Performance (Musical Theatre) major.,Colleen Beucher,[],2,Music
MUS4905,Projects and Problems in Music,Individual work in music and music education.,Prereq: Music major.,Charles Pickeral,[],VAR,Music
MUS6905,Projects and Problems,Approved problems for study and research.,,Charles Pickeral,[],VAR,Music
MUS6910,Supervised Research,Supervised Research,,Charles Pickeral,[],VAR,Music
MUS6940,Supervised Teaching,Supervised Teaching,,Charles Pickeral,[],VAR,Music
MUS6971,Research for Master's Thesis,Research for Master's Thesis,,Charles Pickeral,[],VAR,Music
MUS7905,Projects and Problems,For doctoral students. Approved problems for study and research.,,Charles Pickeral,[],VAR,Music
MUS7979,Advanced Research,Research for doctoral students before admission to candidacy. Designed for students with a master's degree in the field of study or for students who have been accepted for a doctoral program. Not appropriate for students who have been admitted to candidacy.,,Charles Pickeral,[],VAR,Music
MUS7980,Research for Doctoral Dissertation,Research for Doctoral Dissertation,,Charles Pickeral,[],VAR,Music
ZOO4911,Undergraduate Research in Zoology: UF IN KENYA,"Provides firsthand, supervised research. Projects may involve inquiry, design, investigation, scholarship, discovery, or application.",,Todd Palmer,[],3,Zoology
ZOO4926,Special Topics in Zoology: Marine Science in Galapagos,"Lectures, conferences or laboratory sessions covering selected topics of current interest in zoology.","Can be repeated with change in content up to 8 credits. Prereq: BSC 2011 and BSC 2011L, or equivalent, with minimum grades of C, and instructor permission.",Melissa Meadows,"[{'meetNo': 1, 'meetDays': ['M', 'W', 'F'], 'meetTimeBegin': '9:30 AM', 'meetTimeEnd': '12:15 PM', 'meetPeriodBegin': '2', 'meetPeriodEnd': '3', 'meetBuilding': '', 'meetBldgCode': 'WEB', 'meetRoom': ''}]",VAR,Zoology
ZOO4926,Special Topics in Zoology: Biology of Sharks & Rays,"Lectures, conferences or laboratory sessions covering selected topics of current interest in zoology.","Can be repeated with change in content up to 8 credits. Prereq: BSC 2011 and BSC 2011L, or equivalent, with minimum grades of C, and instructor permission.",Gavin Naylor,"[{'meetNo': 1, 'meetDays': ['M', 'T', 'W', 'R', 'F', 'S'], 'meetTimeBegin': '8:00 AM', 'meetTimeEnd': '9:45 PM', 'meetPeriodBegin': '1', 'meetPeriodEnd': 'E2', 'meetBuilding': 'TUR', 'meetBldgCode': '0267', 'meetRoom': '2346'}]",4,Zoology
ZOO4956,Overseas Studies: UF in Galapogos,Provides a mechanism by which coursework taken as part of an approved study abroad program can be recorded on the UF transcript and counted toward graduation.,Prereq: BSC 2011 and 2011L with minimum grades of C and undergraduate advisor permission.,Melissa Meadows,"[{'meetNo': 1, 'meetDays': ['M', 'W', 'F'], 'meetTimeBegin': '2:00 PM', 'meetTimeEnd': '4:45 PM', 'meetPeriodBegin': '5', 'meetPeriodEnd': '6', 'meetBuilding': '', 'meetBldgCode': 'WEB', 'meetRoom': ''}]",3,Zoology
ZOO4956,Overseas Studies: UF IN CUSCO,Provides a mechanism by which coursework taken as part of an approved study abroad program can be recorded on the UF transcript and counted toward graduation.,Prereq: BSC 2011 and 2011L with minimum grades of C and undergraduate advisor permission.,Jose Ponciano Castellanos,[],VAR,Zoology
ZOO4956,Overseas Studies: UF in KENYA,Provides a mechanism by which coursework taken as part of an approved study abroad program can be recorded on the UF transcript and counted toward graduation.,Prereq: BSC 2011 and 2011L with minimum grades of C and undergraduate advisor permission.,Todd Palmer,[],VAR,Zoology
ZOO6927,Special Topics in Zoology: Biology of Sharks & Rays,Special Topics in Zoology,,Gavin Naylor,"[{'meetNo': 1, 'meetDays': ['M', 'T', 'W', 'R', 'F', 'S'], 'meetTimeBegin': '8:00 AM', 'meetTimeEnd': '9:45 PM', 'meetPeriodBegin': '1', 'meetPeriodEnd': 'E2', 'meetBuilding': 'LIT', 'meetBldgCode': '0655', 'meetRoom': '0127'}]",4,Zoology
ZOO4905,Individual Studies in Zoology,Qualified students and the instructor concerned may choose a particular topic or problem for study.,"Credits: 1 to 4; can be repeated for full credit; Prereq: BSC 2011 and 2011L, or equivalent, with minimum grades of C, and instructor permission.",Bernard Hauser,[],VAR,Zoology
ZOO4911,Undergraduate Research in Zoology,"Provides firsthand, supervised research. Projects may involve inquiry, design, investigation, scholarship, discovery, or application.",,Bernard Hauser,[],VAR,Zoology
ZOO4940,Practical Experience in Teaching Zoology,"Participation in teaching approved Zoology courses with practical experience in instructional procedures, testing and grading, course and laboratory preparation, and laboratory assistance. Cannot be used to satisfy the minimum credit requirement for Zoology majors.","Credits: 2; Prereq: BSC 2011 and 2011L, or equivalent, with minimum grades of C, one zoology laboratory-based course, senior status and instructor permission.",Bernard Hauser,[],2,Zoology
ZOO6905,Individual Studies,Individual Studies,,Charles Baer,[],VAR,Zoology
ZOO6910,Supervised Research,Supervised Research,,Charles Baer,[],VAR,Zoology
ZOO6971,Research for Master's Thesis,Research for Master's Thesis,,Charles Baer,[],VAR,Zoology
ZOO7979,Advanced Research,Research for doctoral students before admission to candidacy. Designed for students with a master's degree in the field of study or for students who have been admitted for a doctoral program. Not appropriate for students who have been admitted to candidacy.,,Charles Baer,[],VAR,Zoology
ZOO7980,Research for Doctoral Dissertation,Research for Doctoral Dissertation,,Charles Baer,[],VAR,Zoology
ZOO4905,Individual Studies in Zoology: INDIV STUDIES ZOOLOGY,Qualified students and the instructor concerned may choose a particular topic or problem for study.,"Credits: 1 to 4; can be repeated for full credit; Prereq: BSC 2011 and 2011L, or equivalent, with minimum grades of C, and instructor permission.",Bernard Hauser,[],VAR,Zoology
ZOO4911,Undergraduate Research in Zoology: UG RES ZOOLOGY,"Provides firsthand, supervised research. Projects may involve inquiry, design, investigation, scholarship, discovery, or application.",,Bernard Hauser,[],VAR,Zoology
ZOO4940,Practical Experience in Teaching Zoology,"Participation in teaching approved Zoology courses with practical experience in instructional procedures, testing and grading, course and laboratory preparation, and laboratory assistance. Cannot be used to satisfy the minimum credit requirement for Zoology majors.","Credits: 2; Prereq: BSC 2011 and 2011L, or equivalent, with minimum grades of C, one zoology laboratory-based course, senior status and instructor permission.",Bernard Hauser,[],2,Zoology
ZOO6905,Individual Studies,Individual Studies,,Charles Baer,[],VAR,Zoology
ZOO6910,Supervised Research,Supervised Research,,Charles Baer,[],VAR,Zoology
ZOO6971,Research for Master's Thesis,Research for Master's Thesis,,Charles Baer,[],VAR,Zoology
ZOO7979,Advanced Research,Research for doctoral students before admission to candidacy. Designed for students with a master's degree in the field of study or for students who have been admitted for a doctoral program. Not appropriate for students who have been admitted to candidacy.,,Charles Baer,[],VAR,Zoology
ZOO7980,Research for Doctoral Dissertation,Research for Doctoral Dissertation,,Charles Baer,[],VAR,Zoology
PCB3063,Genetics,"Fundamental properties of inheritance in eukaryotic organisms emphasizing examples in humans. Develops basic concepts for the nature, organization, transmission, expression, recombination, and function of genetic materials, and principles derived for genetically characterizing populations.","Prereq: BSC 2011 and BSC 2011L, or equivalent, with minimum grades of C and general chemistry.",Scott Taylor,[],4,Zoology
PCB4043C,General Ecology,Ecological processes and organization in terrestrial and aquatic habitats. Laboratory and field exercises emphasize techniques of ecological analysis.,"Prereq: BSC 2011 and 2011L, or equivalent, with minimum grades of C.",Stefanie Gazda,[],4,Zoology
PCB4674,Evolution,"Processes and mechanisms of evolution, including population genetics, speciation, patterns of evolution and molecular evolution.","Prereq: BSC 2011 and BSC 2011L, or equivalent, with minimum grades of C; Coreq: one semester of calculus; PCB 3063 recommended.",Norman Douglas,[],4,Zoology
ZOO4905,Individual Studies in Zoology: INDIV STUDIES ZOOLOGY,Qualified students and the instructor concerned may choose a particular topic or problem for study.,"Credits: 1 to 4; can be repeated for full credit; Prereq: BSC 2011 and 2011L, or equivalent, with minimum grades of C, and instructor permission.",Bernard Hauser,[],VAR,Zoology
ZOO4911,Undergraduate Research in Zoology,"Provides firsthand, supervised research. Projects may involve inquiry, design, investigation, scholarship, discovery, or application.",,Bernard Hauser,[],VAR,Zoology
ZOO4940,Practical Experience in Teaching Zoology,"Participation in teaching approved Zoology courses with practical experience in instructional procedures, testing and grading, course and laboratory preparation, and laboratory assistance. Cannot be used to satisfy the minimum credit requirement for Zoology majors.","Credits: 2; Prereq: BSC 2011 and 2011L, or equivalent, with minimum grades of C, one zoology laboratory-based course, senior status and instructor permission.",Bernard Hauser,[],2,Zoology
ZOO6905,Individual Studies,Individual Studies,,Charles Baer,[],VAR,Zoology
ZOO6910,Supervised Research,Supervised Research,,Charles Baer,[],VAR,Zoology
ZOO6971,Research for Master's Thesis,Research for Master's Thesis,,Charles Baer,[],VAR,Zoology
ZOO7979,Advanced Research,Research for doctoral students before admission to candidacy. Designed for students with a master's degree in the field of study or for students who have been admitted for a doctoral program. Not appropriate for students who have been admitted to candidacy.,,Charles Baer,[],VAR,Zoology
ZOO7980,Research for Doctoral Dissertation,Research for Doctoral Dissertation,,Charles Baer,[],VAR,Zoology
